{
  "$schema": "http://json-schema.org/draft-04/schema#",
  "title": "Fair",
  "description": "A single arms and security fair, possibly including exhibitors and/or delegations.",
  "definitions": {
    "text": {
      "description": "A non-empty string.",
      "type": "string",
      "pattern": "^."
    },
    "textOrTextArray": {
      "anyOf": [
        {
          "$ref": "#/definitions/text"
        },
        {
          "type": "array",
          "items": {
            "$ref": "#/definitions/text"
          }
        }
      ]
    },
    "url": {
      "$comment": "Poor source data will not pass even the simplest URL regex rule.",
      "type": "string"
    },
    "urlOrUrlArray": {
      "anyOf": [
        {
          "$ref": "#/definitions/url"
        },
        {
          "type": "array",
          "items": {
            "$ref": "#/definitions/url"
          }
        }
      ]
    },
    "dateString": {
      "type": "string",
      "pattern": "^[0-9]{4}-[0-9]{2}-[0-9]{2}$"
    },
    "dateStringPartial": {
      "type": "string",
      "pattern": "^[0-9]{4}(-[0-9]{2}){0,2}$"
    },
    "utcDatetimeString": {
      "type": "string",
      "pattern": "^[0-9]{4}-[0-9]{2}-[0-9]{2}T[0-9]{2}:[0-9]{2}:[0-9]{2}\\+00:00$"
    },
    "iso2": {
      "type": "string",
      "pattern": "^[A-Z]{2}$"
    },
    "address": {
      "anyOf": [
        {
          "type": "string"
        },
        {
          "type": "object",
          "properties": {
            "text": {
              "type": "string"
            },
            "iso2": {
              "$ref": "#/definitions/iso2"
            },
            "lat": {
              "type": "number",
              "minimum": -90,
              "maximum": 90
            },
            "lon": {
              "type": "number",
              "minimum": -180,
              "maximum": 180
            }
          },
          "required": [
            "text",
            "iso2",
            "lat",
            "lon"
          ],
          "additionalProperties": false
        }
      ]
    },
    "addressOrAddressArray": {
      "anyOf": [
        {
          "$ref": "#/definitions/address"
        },
        {
          "type": "array",
          "items": {
            "$ref": "#/definitions/address"
          }
        }
      ]
    },
    "country": {
      "anyOf": [
        {
          "type": "string"
        },
        {
          "type": "object",
          "properties": {
            "text": {
              "type": "string"
            },
            "iso2": {
              "$ref": "#/definitions/iso2"
            }
          },
          "required": [
            "text",
            "iso2"
          ],
          "additionalProperties": false
        }
      ]
    },
    "countryOrCountryArray": {
      "anyOf": [
        {
          "$ref": "#/definitions/country"
        },
        {
          "type": "array",
          "items": {
            "$ref": "#/definitions/country"
          }
        }
      ]
    },
    "social": {
      "type": "object",
      "oneOf": [
        {
          "required": [
            "platform",
            "handle"
          ]
        },
        {
          "required": [
            "platform",
            "url"
          ]
        }
      ],
      "properties": {
        "platform": {
          "$ref": "#/definitions/text"
        },
        "handle": {
          "$ref": "#/definitions/text"
        },
        "url": {
          "$ref": "#/definitions/text"
        }
      }
    },
    "socialOrSocialArray": {
      "anyOf": [
        {
          "$ref": "#/definitions/social"
        },
        {
          "type": "array",
          "items": {
            "$ref": "#/definitions/social"
          }
        }
      ]
    },
    "exhibitor": {
      "type": "object",
      "required": [
        "name"
      ],
      "additionalProperties": false,
      "properties": {
        "name": {
          "$ref": "#/definitions/text"
        },
        "alias": {
          "$ref": "#/definitions/textOrTextArray"
        },
        "exhibitorUrl": {
          "$ref": "#/definitions/url"
        },
        "address": {
          "$ref": "#/definitions/addressOrAddressArray"
        },
        "country": {
          "$ref": "#/definitions/countryOrCountryArray"
        },
        "website": {
          "$ref": "#/definitions/urlOrUrlArray"
        },
        "email": {
          "$ref": "#/definitions/textOrTextArray"
        },
        "telephone": {
          "$ref": "#/definitions/textOrTextArray"
        },
        "social": {
          "$ref": "#/definitions/socialOrSocialArray"
        },
        "category": {
          "$ref": "#/definitions/textOrTextArray"
        }
      }
    },
    "organiser": {
      "type": "object",
      "required": [
        "name"
      ],
      "additionalProperties": false,
      "properties": {
        "name": {
          "$ref": "#/definitions/text"
        },
        "alias": {
          "$ref": "#/definitions/textOrTextArray"
        },
        "address": {
          "$ref": "#/definitions/addressOrAddressArray"
        },
        "country": {
          "$ref": "#/definitions/countryOrCountryArray"
        },
        "website": {
          "$ref": "#/definitions/urlOrUrlArray"
        },
        "email": {
          "$ref": "#/definitions/textOrTextArray"
        },
        "telephone": {
          "$ref": "#/definitions/textOrTextArray"
        },
        "social": {
          "$ref": "#/definitions/socialOrSocialArray"
        }
      }
    }
  },
  "type": "object",
  "required": [
    "name"
  ],
  "oneOf": [
    {
      "required": [
        "startDate",
        "endDate"
      ]
    },
    {
      "required": [
        "approxDate"
      ]
    }
  ],
  "dependencies": {
    "exhibitor": [
      "exhibitorListDate"
    ],
    "delegation": [
      "delegationListDate"
    ]
  },
  "additionalProperties": false,
  "properties": {
    "name": {
      "$ref": "#/definitions/text"
    },
    "alias": {
      "$ref": "#/definitions/textOrTextArray"
    },
    "series": {
      "$ref": "#/definitions/text"
    },
    "edition": {
      "$ref": "#/definitions/text"
    },
    "startDate": {
      "$ref": "#/definitions/dateString"
    },
    "endDate": {
      "$ref": "#/definitions/dateString"
    },
    "approxDate": {
      "$ref": "#/definitions/dateStringPartial"
    },
    "address": {
      "$ref": "#/definitions/addressOrAddressArray"
    },
    "country": {
      "$ref": "#/definitions/countryOrCountryArray"
    },
    "online": {
      "type": "boolean"
    },
    "website": {
      "$ref": "#/definitions/urlOrUrlArray"
    },
    "social": {
      "$ref": "#/definitions/socialOrSocialArray"
    },
    "organiser": {
      "anyOf": [
        {
          "$ref": "#/definitions/organiser"
        },
        {
          "type": "array",
          "items": {
            "$ref": "#/definitions/organiser"
          }
        }
      ]
    },
    "exhibitorListUrl": {
      "$ref": "#/definitions/url"
    },
    "exhibitorListDate": {
      "$ref": "#/definitions/utcDatetimeString"
    },
    "exhibitor": {
      "type": "array",
      "items": {
        "$ref": "#/definitions/exhibitor"
      }
    },
    "exhibitorListIncomplete": {
      "type": "boolean",
      "const": true
    },
    "delegationListUrl": {
      "$ref": "#/definitions/url"
    },
    "delegationListDate": {
      "$ref": "#/definitions/utcDatetimeString"
    },
    "delegation": {
      "type": "array",
      "items": {
        "type": "object",
        "required": [
          "name"
        ],
        "additionalProperties": false,
        "properties": {
          "name": {
            "$ref": "#/definitions/text"
          },
          "attended": {
            "type": "boolean"
          },
          "retracted": {
            "type": "boolean"
          }
        }
      }
    }
  }
}
