{
  "name": "IFSEC International 2016",
  "series": "IFSEC International",
  "edition": "2016",
  "alias": "International Fire and Security Exhibition and Conference International 2016",
  "approxDate": "2016",
  "website": "https://www.ifsecglobal.com/event/en/home.html",
  "country": "United Kingdom"
}
