{
  "name": "Securex South Africa 2009",
  "series": "Securex South Africa",
  "edition": "2009",
  "alias": [
    "IFSEC SA 2009",
    "IFSEC South Africa 2009"
  ],
  "startDate": "2009-06-30",
  "endDate": "2009-07-02",
  "address": {
    "text": "Gallagher Convention Centre\n19 Richards Drive\nMidrand\nJohannesburg\nSouth Africa",
    "iso2": "ZA",
    "lat": -26.0016667,
    "lon": 28.1297222
  },
  "website": "http://www.ifsecsa.com",
  "organiser": [
    {
      "name": "UBM",
      "website": "http://www.cmpi.biz/ubmlive"
    }
  ],
  "exhibitorListUrl": "http://www.ifsecsa.com",
  "exhibitorListDate": "2022-03-11T16:52:03+00:00",
  "exhibitor": [
    {
      "name": "ID Card Technologies"
    },
    {
      "name": "ADI"
    },
    {
      "name": "All Technologies Access Parking (Pty) Ltd"
    },
    {
      "name": "Audiosure"
    },
    {
      "name": "Axis Communications SA Pty Ltd"
    },
    {
      "name": "Centurion Systems"
    },
    {
      "name": "Classic Acoustics"
    },
    {
      "name": "Classic Systems"
    },
    {
      "name": "CIEFFE"
    },
    {
      "name": "Cochrane Steel Products"
    },
    {
      "name": "Connoisseur Electronics"
    },
    {
      "name": "Connoisseur Electronics"
    },
    {
      "name": "Control soft"
    },
    {
      "name": "Defence Concepts South Africa"
    },
    {
      "name": "Emergency Reaction Services"
    },
    {
      "name": "Fox Electronics"
    },
    {
      "name": "Frank Street"
    },
    {
      "name": "FSK"
    },
    {
      "name": "Gallagher Power"
    },
    {
      "name": "GeoVision South Africa"
    },
    {
      "name": "Global Armour"
    },
    {
      "name": "Global Communications"
    },
    {
      "name": "Guardtrack"
    },
    {
      "name": "HAB International Fire & Security (Pty) Ltd"
    },
    {
      "name": "Hid Global"
    },
    {
      "name": "Hudaco Trading (Pty) Ltd (Elvey)"
    },
    {
      "name": "Ideco Registration"
    },
    {
      "name": "Illuder"
    },
    {
      "name": "Imperial Armour"
    },
    {
      "name": "Impro"
    },
    {
      "name": "Industrial Automation"
    },
    {
      "name": "MAMI"
    },
    {
      "name": "Martin Electronics cc"
    },
    {
      "name": "Motorola"
    },
    {
      "name": "Multi Locking Vehicle Tracking Security"
    },
    {
      "name": "Nemtek"
    },
    {
      "name": "Network Video Tech"
    },
    {
      "name": "Norbain"
    },
    {
      "name": "Questek"
    },
    {
      "name": "R&D Screening Technologies"
    },
    {
      "name": "Regal Eltro Pty Ltd"
    },
    {
      "name": "Saflec / Saflec Systems"
    },
    {
      "name": "Sambane International"
    },
    {
      "name": "Sanyo"
    },
    {
      "name": "Security & Communication Warehouse"
    },
    {
      "name": "Senstar-Stellar Corporation"
    },
    {
      "name": "Sentronics"
    },
    {
      "name": "Sherlotronics"
    },
    {
      "name": "Space TV"
    },
    {
      "name": "Spectrum Communications"
    },
    {
      "name": "Stafix"
    },
    {
      "name": "Tele eye"
    },
    {
      "name": "Telkom"
    },
    {
      "name": "Therma Card"
    },
    {
      "name": "Trac - Tech"
    },
    {
      "name": "Transaction Control"
    },
    {
      "name": "Trinity Telecomms"
    },
    {
      "name": "Uniclox Technologies"
    },
    {
      "name": "Y- Cam"
    }
  ]
}
