{
  "name": "NLW 2019",
  "series": "NLW",
  "alias": [
    "10th European Symposium on Non-Lethal Weapons"
  ],
  "edition": "2019",
  "startDate": "2019-05-20",
  "endDate": "2019-05-23",
  "address": {
    "text": "Royal Military Academy\nBrussels\nBelgium",
    "iso2": "BE",
    "lat": 50.8445816,
    "lon": 4.393333
  },
  "website": [
    "https://www.non-lethal-weapons.org/en/symposia/symposium-2018.html",
    "https://v3.globalcube.net/clients/ewgv1/content/medias/symposia/10_brussels/sy10programme.pdf"
  ],
  "organiser": [
    {
      "name": "European Working Group Non-Lethal Weapons",
      "website": "www.non-lethal-weapons.com"
    }
  ]
}
