{
  "name": "ISDEF 2013",
  "series": "ISDEF",
  "edition": "2013",
  "alias": "International Defence and Homeland Security Expo 2013",
  "approxDate": "2013",
  "website": "https://www.isdefexpo.com/#:~:text=ISDEF%202021%20will%20bring%20together,transfer%20to%20ensure%20public%20safety.",
  "country": "Israel"
}
