{
  "name": "Securex Uzbekistan 2021",
  "series": "Securex Uzbekistan",
  "edition": "2021",
  "alias": "12th Central Asian International Exhibition for Industrial Safety. Personal Protection Technologies. Equipment & systems for security & fire extinguishing. IT solutions. Data security",
  "startDate": "2021-11-03",
  "endDate": "2021-11-05",
  "address": "Tashkent\nUzbekistan",
  "website": "https://securex.uz/en/",
  "organiser": [
    {
      "name": "Iteca Exhibitions",
      "website": "https://iteca.uz",
      "social": [
        {
          "platform": "facebook",
          "url": "https://www.facebook.com/ItecaExhibitions/"
        },
        {
          "platform": "twitter",
          "url": "https://twitter.com/ItecaExhibition"
        }
      ]
    }
  ],
  "exhibitorListUrl": "https://www.securex.uz/en/exhibition/spisok-uchastnikov.php",
  "exhibitorListDate": "2022-03-13T13:05:55+00:00",
  "exhibitor": [
    {
      "name": "ASKARI SHOE PROJECT"
    },
    {
      "name": "AVANT GUARD, LLC"
    },
    {
      "name": "BRASSCO"
    },
    {
      "name": "DEFENCE EXPORT PROMOTION ORGANIZATION (DEPO)"
    },
    {
      "name": "ENERGOCONTRACT"
    },
    {
      "name": "EXPORT SUPPORT CENTER OF TOMSK REGION"
    },
    {
      "name": "HUAWEI TECH INVESTMENT TASHKENT, FE LLC"
    },
    {
      "name": "NATIONAL RADIO & TELECOMMUNICATION CORPORATION"
    },
    {
      "name": "NEW SOLUTION SERVICE, LLC"
    },
    {
      "name": "OLVIA"
    },
    {
      "name": "PAKISTAN MACHINE TOOL FACTORY (PVT) LTD"
    },
    {
      "name": "PAKISTAN ORDNANCE FACTORIES"
    },
    {
      "name": "POLIMASTER"
    },
    {
      "name": "REGULA"
    },
    {
      "name": "RUSSKAYA SVARKA, LLC"
    },
    {
      "name": "STAR LIGHT TECHNOLOGY"
    },
    {
      "name": "TBS INFORM, LLC"
    }
  ]
}
