{
  "name": "IFSEC India 2008",
  "series": "IFSEC India",
  "edition": "2008",
  "startDate": "2008-10-16",
  "endDate": "2008-10-18",
  "address": {
    "text": "Pragati Maidan\nNew Delhi\nIndia",
    "iso2": "IN",
    "lat": 28.6126456,
    "lon": 77.2433578
  },
  "website": "http://www.ifsecindia.com",
  "organiser": [
    {
      "name": "CMP Information",
      "website": "http://www.cmpi.biz"
    }
  ],
  "exhibitorListUrl": "http://www.ifsecindia.com/ifsec08/exhibitors.html?e",
  "exhibitorListDate": "2022-03-10T21:40:58+00:00",
  "exhibitor": [
    {
      "name": "A & S Group"
    },
    {
      "name": "A V Systems"
    },
    {
      "name": "ACTAtek Ltd"
    },
    {
      "name": "Adept Designs"
    },
    {
      "name": "ADI"
    },
    {
      "name": "Adion Technologies Pvt. Ltd."
    },
    {
      "name": "Adit Enterprise"
    },
    {
      "name": "Aditya Infotech Ltd."
    },
    {
      "name": "Adtech Systems Limited"
    },
    {
      "name": "Advanced Detection Technology"
    },
    {
      "name": "Advert Technologies"
    },
    {
      "name": "Al Waheed General Trading Co. (GBP)"
    },
    {
      "name": "Alba Urmet Comm & Security (P) Ltd."
    },
    {
      "name": "All e Technologies (P) Ltd."
    },
    {
      "name": "AMG Systems"
    },
    {
      "name": "Amron Associates Private Ltd."
    },
    {
      "name": "Aravli Hitech"
    },
    {
      "name": "Arise Security Systems"
    },
    {
      "name": "Arya Communications & Electronics Services Pvt. Lt"
    },
    {
      "name": "Asia Info Company Ltd"
    },
    {
      "name": "Asian Professional Security Association"
    },
    {
      "name": "Astraguard Pvt. Ltd"
    },
    {
      "name": "Autocop Security Solutions Pvt. Ltd."
    },
    {
      "name": "Axis Communication"
    },
    {
      "name": "AXVIEW TECHNOLOGY (SHENZHEN) CO., LTD"
    },
    {
      "name": "AXXON"
    },
    {
      "name": "BFT S.P.A."
    },
    {
      "name": "Bioinsec Co., Ltd"
    },
    {
      "name": "Bitron Video SRL"
    },
    {
      "name": "Biztradeshows.com"
    },
    {
      "name": "Bluecard Software Technology Co Ltd"
    },
    {
      "name": "C A Satyam ASP Pvt. Ltd."
    },
    {
      "name": "CBC Co. Ltd."
    },
    {
      "name": "CDVI"
    },
    {
      "name": "China Public Security"
    },
    {
      "name": "CIEFFE S.p.A"
    },
    {
      "name": "Comm Port Technologies Inc."
    },
    {
      "name": "Computer Recognition Systems"
    },
    {
      "name": "COP SECURITY SYSTEM CORP."
    },
    {
      "name": "Cradle Technologies India Pvt. Ltd."
    },
    {
      "name": "Crockett International"
    },
    {
      "name": "Dallas Semiconductor / MAXIM"
    },
    {
      "name": "Dedicated Micros Ltd"
    },
    {
      "name": "DigiPATROL Ltd"
    },
    {
      "name": "Domo Limited"
    },
    {
      "name": "DVTel, Inc."
    },
    {
      "name": "ECIL"
    },
    {
      "name": "EGuardian International Co., Ltd"
    },
    {
      "name": "Elcom Door Comm (I) Pvt. Ltd."
    },
    {
      "name": "Elkosta Securities Systems India"
    },
    {
      "name": "Enterprise Software Solutions Lab"
    },
    {
      "name": "ET Srl"
    },
    {
      "name": "Etech Media Pvt. Ltd."
    },
    {
      "name": "FAAC India Pvt. Ltd."
    },
    {
      "name": "Falcon Alarms Systems Pvt Ltd"
    },
    {
      "name": "Fermax"
    },
    {
      "name": "Fire & Security Today"
    },
    {
      "name": "Fortuna Impex Pte. Ltd."
    },
    {
      "name": "Fujinon Singapore Pte Ltd"
    },
    {
      "name": "Fuqing Top Way Intelligent Science Technology Co.,"
    },
    {
      "name": "G3 Telebroadcast Convergence Pvt. Ltd."
    },
    {
      "name": "G4S Security Services (I) Pvt. Ltd."
    },
    {
      "name": "Gandhi Entrance Automations Pvt. Ltd."
    },
    {
      "name": "GE Security"
    },
    {
      "name": "Genius SpA"
    },
    {
      "name": "GIGA-TMS Inc"
    },
    {
      "name": "Godrej & Boyce Mfg. Co. Ltd"
    },
    {
      "name": "Golmar Sistemas de Communicacion, S.A"
    },
    {
      "name": "Grandeye Ltd"
    },
    {
      "name": "Hamilton Electronics P.Ltd."
    },
    {
      "name": "Hans India"
    },
    {
      "name": "Harcor Security Seals Pty Ltd"
    },
    {
      "name": "HashNine Managed Comm Ltd"
    },
    {
      "name": "Henan Hanwei Electronics Corp. Ltd"
    },
    {
      "name": "HID India Pvt. Ltd."
    },
    {
      "name": "Honeywell Security"
    },
    {
      "name": "Huper Laboratories Co. Ltd"
    },
    {
      "name": "I2 Limited"
    },
    {
      "name": "ICx Technologies"
    },
    {
      "name": "IJS Security"
    },
    {
      "name": "India SAFE"
    },
    {
      "name": "Indigovision"
    },
    {
      "name": "Innovative Energies"
    },
    {
      "name": "Iomniscient Pty Limited"
    },
    {
      "name": "J Mitra & Co."
    },
    {
      "name": "Kawach Protection Systems Pvt. Ltd."
    },
    {
      "name": "Keystone Electronics"
    },
    {
      "name": "KLA Systems Sdn Bhd."
    },
    {
      "name": "Kowa Co. Ltd."
    },
    {
      "name": "KSH International Co., Ltd."
    },
    {
      "name": "Lookman Electoplast Industries Ltd."
    },
    {
      "name": "M R Impex & Sons"
    },
    {
      "name": "Magnum"
    },
    {
      "name": "Mallcom (India) Limited"
    },
    {
      "name": "Mark Security Electronics Corporation"
    },
    {
      "name": "Mediatronix Pvt. Ltd."
    },
    {
      "name": "Move & Traffic Controls"
    },
    {
      "name": "N S Enterprises"
    },
    {
      "name": "Natchu Security Systems"
    },
    {
      "name": "Neotech Photoelectric Pvt. Ltd."
    },
    {
      "name": "Network Video Technologies,Inc."
    },
    {
      "name": "Nova ETS"
    },
    {
      "name": "Nova International"
    },
    {
      "name": "NVI Technologies Limited."
    },
    {
      "name": "Optex Co. Ltd."
    },
    {
      "name": "Optical Systems Design"
    },
    {
      "name": "OYTO Co Ltd"
    },
    {
      "name": "PANACOM TECHNOLOGY CORP."
    },
    {
      "name": "Panasonic Asia Pacific Pte. Ltd."
    },
    {
      "name": "Payne (India) Private Limited"
    },
    {
      "name": "PCI Limited"
    },
    {
      "name": "Peagasus Equipments Pvt. Ltd."
    },
    {
      "name": "Perpetuity Infotech India Pvt. Ltd."
    },
    {
      "name": "Prama Technologies"
    },
    {
      "name": "Precision Operations Systems (India) Pvt"
    },
    {
      "name": "Prolog Systems Limited"
    },
    {
      "name": "Qualitrade- Takex"
    },
    {
      "name": "Rajpurohi Cardtech Ltd."
    },
    {
      "name": "RBH Technologies India (P) Ltd."
    },
    {
      "name": "Rifatron Co., Ltd."
    },
    {
      "name": "Romtrac"
    },
    {
      "name": "Safety & Security Industry Program Office, MOEA ID"
    },
    {
      "name": "Sagem Defence Securite"
    },
    {
      "name": "Saima Sicurezza SpA"
    },
    {
      "name": "Sambson Watchnet"
    },
    {
      "name": "Samriddhi Automation"
    },
    {
      "name": "Sanyo India (P) Ltd."
    },
    {
      "name": "Seagate"
    },
    {
      "name": "Security Defense Systems"
    },
    {
      "name": "Security Dynamics"
    },
    {
      "name": "Security Today"
    },
    {
      "name": "Senstar-Stellar Corporation"
    },
    {
      "name": "SHENZHEN FUJIKAM INDUSTRY DEVELOPMENT CO. LTD"
    },
    {
      "name": "Siangsiu Industrial Corp"
    },
    {
      "name": "Siemens Building Technologies Pvt. Ltd."
    },
    {
      "name": "SJ Security systems Pvt. Ltd."
    },
    {
      "name": "SKJ Electronic Systems"
    },
    {
      "name": "Solutions Integrated Marketing Services"
    },
    {
      "name": "Sony Electronics (S) Pte. Ltd."
    },
    {
      "name": "Sony India Pvt. Ltd."
    },
    {
      "name": "SPACE inc"
    },
    {
      "name": "Spur Microwave Inc."
    },
    {
      "name": "STR International Inc"
    },
    {
      "name": "Syris Technology Corp."
    },
    {
      "name": "Systems Tek India Pvt. Ltd."
    },
    {
      "name": "Taiwan Electrical and Electronic Manufacturers' As"
    },
    {
      "name": "Taylor Lock Company Ltd"
    },
    {
      "name": "Technocrat Security Systems Pvt. Ltd."
    },
    {
      "name": "TeleEye Holdings Ltd."
    },
    {
      "name": "Thakral Services India Limited"
    },
    {
      "name": "TOMST s.r.o."
    },
    {
      "name": "Tradeindia.com"
    },
    {
      "name": "TRANS PACIFIC INDUSTRIES CORP."
    },
    {
      "name": "Tritech Security Systems Pvt. Ltd."
    },
    {
      "name": "Turbo Consultancy Services Pvt. Ltd."
    },
    {
      "name": "Tyche Peripheral Systems Ltd."
    },
    {
      "name": "Unishilp Electronics (P) Ltd."
    },
    {
      "name": "Univision Enterprises (Shenzhen) Co. Ltd"
    },
    {
      "name": "UWC Electric (M) Sdn Bhd."
    },
    {
      "name": "Vectra Security Solutions Pvt. Ltd."
    },
    {
      "name": "Vetrad Systems"
    },
    {
      "name": "Videcon Plc"
    },
    {
      "name": "Vista Security Technics Pvt. Ltd."
    },
    {
      "name": "WFE TECHNOLOGY CORP,"
    },
    {
      "name": "Z Plus Security Systems Pvt. Ltd."
    }
  ]
}
