{
  "name": "ADS 2016",
  "series": "ADS",
  "edition": "2016",
  "alias": [
    "ADS Show Europe 2016",
    "Aero Defence Support Show 2016",
    "World Military MRO Exhibition"
  ],
  "startDate": "2016-09-28",
  "endDate": "2016-09-29",
  "address": {
    "text": "Base Aérienne 106 - BORDEAUX MERIGNAC\n227 Avenue de l'Argonne\n33700 Mérignac\nFrance",
    "iso2": "FR",
    "lat": 44.8157029,
    "lon": -0.7092976999999999
  },
  "website": "http://www.adsshow.eu",
  "exhibitorListUrl": "http://www.adsshow.eu/fr/413-liste-des-partenaires.html",
  "social": {
    "platform": "twitter",
    "url": "https://twitter.com/ADSShow2016"
  }
}
