{
  "name": "MSPO 2025",
  "series": "MSPO",
  "edition": "2025",
  "alias": [
    "33rd International Defence Industry Exhibition MSPO",
    "Międzynarodowy Salon Przemysłu Obronnego"
  ],
  "startDate": "2025-09-02",
  "endDate": "2025-09-05",
  "address": {
    "text": "Targi Kielce\nSt. Zakładowa 1\n25-672 Kielce\nPoland",
    "iso2": "PL",
    "lat": 50.8989729,
    "lon": 20.5885514
  },
  "website": "https://www.targikielce.pl/en/mspo",
  "organiser": {
    "name": "Targi Kielce",
    "address": "Targi Kielce\nSt. Zakładowa 1\n25-672 Kielce\nPoland",
    "website": "https://www.targikielce.pl",
    "social": [
      {
        "platform": "facebook",
        "url": "https://www.facebook.com/targikielce"
      },
      {
        "platform": "twitter",
        "url": "https://twitter.com/targikielce"
      },
      {
        "platform": "instagram",
        "url": "https://www.instagram.com/targikielce/"
      },
      {
        "platform": "youtube",
        "url": "https://www.youtube.com/user/TargiKielce1"
      },
      {
        "platform": "linkedin",
        "url": "https://www.linkedin.com/company/targi-kielce-sa"
      }
    ]
  }
}
