{
  "name": "CANSEC 2014",
  "series": "CANSEC",
  "edition": "2014",
  "startDate": "2014-05-28",
  "endDate": "2014-05-29",
  "address": {
    "text": "EY Centre\nOttawa\nOntario\nCanada",
    "iso2": "CA",
    "lat": 45.3322655,
    "lon": -75.653978
  },
  "website": "https://www.defenceandsecurity.ca/CANSEC/",
  "organiser": [
    {
      "name": "CADSI",
      "alias": "Canadian Association of Defence and Security Industries",
      "website": "https://www.defenceandsecurity.ca/"
    }
  ]
}
