{
  "name": "AUSA 2019",
  "series": "AUSA",
  "edition": "2019",
  "alias": "Association of the United States Army Annual Meeting 2019",
  "startDate": "2021-10-11",
  "endDate": "2021-10-13",
  "website": "https://meetings.ausa.org/annual/2021/index.cfm",
  "address": "Washington DC\nUnited States"
}
