{
  "name": "SOFEX 2002",
  "series": "SOFEX",
  "alias": [
    "SOFEX Jordan",
    "4th Special Operations Forces Exhibition & Conference"
  ],
  "edition": "2002",
  "startDate": "2002-10-14",
  "endDate": "2002-10-17",
  "address": {
    "text": "King Abdullah I Airbase\nAmman\nJordan",
    "iso2": "JO",
    "lat": 31.991481,
    "lon": 36.0030164
  },
  "website": "https://gulfnews.com/uae/gec-to-stage-sofex-2002-in-amman-next-october-1.429053"
}
