{
  "name": "AOC Europe 2022",
  "series": "AOC Europe",
  "edition": "2022",
  "alias": [
    "Association of Old Crows 2022",
    "Electronic Warfare Europe 2022",
    "EW Europe 2022"
  ],
  "startDate": "2022-05-10",
  "endDate": "2022-05-12",
  "address": "Parc des Expositions de Montpellier\nRte de la Foire\n34470\nPÃ©rols\nFrance",
  "website": "aoceurope.org",
  "social": [
    {
      "platform": "twitter",
      "url": "https://twitter.com/AOCrows"
    },
    {
      "platform": "linkedin",
      "url": "https://www.linkedin.com/company/association-of-old-crows"
    },
    {
      "platform": "vimeo",
      "url": "https://vimeo.com/user100192111"
    }
  ],
  "exhibitorListUrl": "https://www.aoceurope.org/2022-exhibitors",
  "organiser": {
    "name": "Clarion Defence & Security Limited",
    "address": "Bedford House, Fulham High Street, London SW6 3JW, UK"
  },
  "exhibitorListDate": "2022-01-24T17:32:38+00:00",
  "exhibitor": [
    {
      "name": "Alaris Holdings",
      "exhibitorUrl": "https://www.aoceurope.org/exhibitors/alaris-holdings",
      "country": "South Africa"
    },
    {
      "name": "Allen-Vanguard Ltd",
      "exhibitorUrl": "https://www.aoceurope.org/exhibitors/allen-vanguard-ltd",
      "country": "United Kingdom"
    },
    {
      "name": "ApisSys",
      "exhibitorUrl": "https://www.aoceurope.org/exhibitors/apissys",
      "country": "France"
    },
    {
      "name": "BIRD Aerosystems",
      "exhibitorUrl": "https://www.aoceurope.org/exhibitors/bird-aerosystems",
      "country": "Israel"
    },
    {
      "name": "BSC Filters Ltd",
      "exhibitorUrl": "https://www.aoceurope.org/exhibitors/bsc-filters-ltd",
      "country": "United Kingdom"
    },
    {
      "name": "Babcock Integrated Technology",
      "exhibitorUrl": "https://www.aoceurope.org/exhibitors/babcock-integrated-technology",
      "country": "United Kingdom"
    },
    {
      "name": "CRFS Limited",
      "exhibitorUrl": "https://www.aoceurope.org/exhibitors/crfs-limited",
      "country": "United Kingdom"
    },
    {
      "name": "Chora A/S",
      "exhibitorUrl": "https://www.aoceurope.org/exhibitors/chora-a/s",
      "country": "Denmark"
    },
    {
      "name": "Clarion Defence and Security",
      "exhibitorUrl": "https://www.aoceurope.org/exhibitors/clarion-defence-and-security",
      "address": "Bedford House\n69-79 Fullham High St\nFulham\nSW6 3JW\nUnited Kingdom",
      "website": "https://www.clarion-defence.com/"
    },
    {
      "name": "Communications Audit UK Ltd.",
      "exhibitorUrl": "https://www.aoceurope.org/exhibitors/communications-audit-uk-ltd",
      "country": "United Kingdom"
    },
    {
      "name": "Decodio AG",
      "exhibitorUrl": "https://www.aoceurope.org/exhibitors/decodio-ag",
      "country": "Switzerland"
    },
    {
      "name": "ELDES s.r.l",
      "exhibitorUrl": "https://www.aoceurope.org/exhibitors/eldes-srl",
      "address": ".\n.\nItaly"
    },
    {
      "name": "ELETTRONICA S.P.A.",
      "exhibitorUrl": "https://www.aoceurope.org/exhibitors/elettronica-spa",
      "country": "Italy"
    },
    {
      "name": "ELTA Systems",
      "exhibitorUrl": "https://www.aoceurope.org/exhibitors/elta-systems",
      "country": "Israel"
    },
    {
      "name": "ERA a.s.",
      "exhibitorUrl": "https://www.aoceurope.org/exhibitors/era-as",
      "country": "Czech Republic"
    },
    {
      "name": "ERZIA",
      "exhibitorUrl": "https://www.aoceurope.org/exhibitors/erzia",
      "country": "Spain"
    },
    {
      "name": "Elbit Systems EW and SIGINT",
      "exhibitorUrl": "https://www.aoceurope.org/exhibitors/elbit-systems-ew-and-sigint",
      "address": ".\n.\nIsrael"
    },
    {
      "name": "Empower RF Systems",
      "exhibitorUrl": "https://www.aoceurope.org/exhibitors/empower-rf-systems",
      "country": "United States"
    },
    {
      "name": "Epiq Solutions",
      "exhibitorUrl": "https://www.aoceurope.org/exhibitors/epiq-solutions",
      "country": "United States"
    },
    {
      "name": "FS Antennentechnik GmbH",
      "exhibitorUrl": "https://www.aoceurope.org/exhibitors/fs-antennentechnik-gmbh",
      "country": "Germany"
    },
    {
      "name": "FinFisher GmbH",
      "exhibitorUrl": "https://www.aoceurope.org/exhibitors/finfisher-gmbh",
      "country": "Germany"
    },
    {
      "name": "Galleon Embedded Computing AS",
      "exhibitorUrl": "https://www.aoceurope.org/exhibitors/galleon-embedded-computing-as",
      "country": "Norway"
    },
    {
      "name": "Glenair France",
      "exhibitorUrl": "https://www.aoceurope.org/exhibitors/glenair-france",
      "country": "France"
    },
    {
      "name": "HENSOLDT Holding Germany GmbH",
      "exhibitorUrl": "https://www.aoceurope.org/exhibitors/hensoldt-holding-germany-gmbh",
      "country": "Germany"
    },
    {
      "name": "Huber + Suhner",
      "exhibitorUrl": "https://www.aoceurope.org/exhibitors/huber-suhner",
      "address": ".\n.\nSwitzerland"
    },
    {
      "name": "Interface Concept",
      "exhibitorUrl": "https://www.aoceurope.org/exhibitors/interface-concept",
      "country": "France"
    },
    {
      "name": "Leonardo MW Ltd",
      "exhibitorUrl": "https://www.aoceurope.org/exhibitors/leonardo-mw-ltd",
      "country": "United Kingdom"
    },
    {
      "name": "MBDA FRANCE",
      "exhibitorUrl": "https://www.aoceurope.org/exhibitors/mbda-france",
      "country": "France"
    },
    {
      "name": "Microwave Specialty Company",
      "exhibitorUrl": "https://www.aoceurope.org/exhibitors/microwave-specialty-company",
      "country": "United States"
    },
    {
      "name": "NSI-MI Technologies",
      "exhibitorUrl": "https://www.aoceurope.org/exhibitors/nsi-mi-technologies",
      "country": "United States"
    },
    {
      "name": "Novator Solutions AB",
      "exhibitorUrl": "https://www.aoceurope.org/exhibitors/novator-solutions-ab",
      "country": "Sweden"
    },
    {
      "name": "Ocupoint",
      "exhibitorUrl": "https://www.aoceurope.org/exhibitors/ocupoint",
      "country": "United States"
    },
    {
      "name": "PROCITEC GmbH",
      "exhibitorUrl": "https://www.aoceurope.org/exhibitors/procitec-gmbh",
      "country": "Germany"
    },
    {
      "name": "Photonis Defense, Inc.",
      "exhibitorUrl": "https://www.aoceurope.org/exhibitors/photonis-defense-inc",
      "country": "United States"
    },
    {
      "name": "RUAG Schweiz AG",
      "exhibitorUrl": "https://www.aoceurope.org/exhibitors/ruag-schweiz-ag",
      "country": "Switzerland"
    },
    {
      "name": "Rohde & Schwarz GmbH & Co. KG",
      "exhibitorUrl": "https://www.aoceurope.org/exhibitors/rohde-schwarz-gmbh-co-kg",
      "country": "Germany"
    },
    {
      "name": "SAAB AB..",
      "exhibitorUrl": "https://www.aoceurope.org/exhibitors/saab-ab",
      "country": "Sweden"
    },
    {
      "name": "Sch'nhofer Sales and Engineering GmbH",
      "exhibitorUrl": "https://www.aoceurope.org/exhibitors/schnhofer-sales-and-engineering-gmbh",
      "country": "Germany"
    },
    {
      "name": "Swissto12",
      "exhibitorUrl": "https://www.aoceurope.org/exhibitors/swissto12",
      "country": "Israel"
    },
    {
      "name": "TCI International",
      "exhibitorUrl": "https://www.aoceurope.org/exhibitors/tci-international",
      "country": "United States"
    },
    {
      "name": "TMD Technologies",
      "exhibitorUrl": "https://www.aoceurope.org/exhibitors/tmd-technologies",
      "country": "United Kingdom"
    },
    {
      "name": "Textron Systems",
      "exhibitorUrl": "https://www.aoceurope.org/exhibitors/textron-systems",
      "country": "United States"
    },
    {
      "name": "Thales Communications & Security",
      "exhibitorUrl": "https://www.aoceurope.org/exhibitors/thales-communications-security",
      "country": "France"
    },
    {
      "name": "Ultra",
      "exhibitorUrl": "https://www.aoceurope.org/exhibitors/ultra",
      "country": "United Kingdom"
    },
    {
      "name": "VIAVI Solutions, Inc.",
      "exhibitorUrl": "https://www.aoceurope.org/exhibitors/viavi-solutions-inc",
      "country": "United States"
    },
    {
      "name": "WORK Microwave",
      "exhibitorUrl": "https://www.aoceurope.org/exhibitors/work-microwave",
      "country": "Germany"
    },
    {
      "name": "boger electronics GmbH",
      "exhibitorUrl": "https://www.aoceurope.org/exhibitors/boger-electronics-gmbh",
      "country": "Germany"
    }
  ]
}
