{
  "name": "IAVs 2013",
  "series": "IAVs",
  "edition": "2013",
  "alias": "International Armoured Vehicles 2013",
  "startDate": "2013-02-05",
  "endDate": "2013-02-08",
  "address": {
    "text": "FIVE\nFarnborough\nUK",
    "iso2": "GB",
    "lat": 51.2753235,
    "lon": -0.7665162999999999
  },
  "website": [
    "http://www.internationalarmouredvehicles.com",
    "http://internationalarmouredvehicles.wordpress.com"
  ],
  "social": [
    {
      "platform": "twitter",
      "url": "http://twitter.com/IAVehicles"
    },
    {
      "platform": "linkedin",
      "url": "http://www.linkedin.com/groupRegistration?gid=162026"
    },
    {
      "platform": "facebook",
      "url": "http://www.facebook.com/pages/London-United-Kingdom/International-Armoured-Vehicles/104213052965477"
    }
  ],
  "organiser": [
    {
      "name": "IQPC",
      "website": "http://www.iqpc.com"
    },
    {
      "name": "Defence IQ",
      "website": "http://www.defenceiq.com"
    }
  ],
  "exhibitorListUrl": "http://www.internationalarmouredvehicles.com/Event.aspx?id=734202",
  "exhibitorListDate": "2022-02-02T16:32:38+00:00",
  "exhibitor": [
    {
      "name": "Ares Security Vehicles"
    },
    {
      "name": "ArmourWorks International Ltd"
    },
    {
      "name": "Barco NV"
    },
    {
      "name": "Brimar Ltd."
    },
    {
      "name": "Constellium"
    },
    {
      "name": "FFG Flensburger Fahrzeugbau Gesellschaft mbH"
    },
    {
      "name": "GoodWolfe Energy"
    },
    {
      "name": "GuS GmbH & Co. KG"
    },
    {
      "name": "Hutchinson Defence"
    },
    {
      "name": "ITT Corporation"
    },
    {
      "name": "Igus (UK) Ltd"
    },
    {
      "name": "International Armored Group, (IAG)"
    },
    {
      "name": "Iveco Defence Vehicles"
    },
    {
      "name": "JCB Government and Defence"
    },
    {
      "name": "KTK"
    },
    {
      "name": "Kaller Str√∂msholmen AB"
    },
    {
      "name": "Kembrey Wiring Systems Ltd"
    },
    {
      "name": "Kent Modular Electronics Limited (KME)"
    },
    {
      "name": "Lorica Systems"
    },
    {
      "name": "MJ Services aka ThermBright"
    },
    {
      "name": "PPG Aerospace"
    },
    {
      "name": "Polamco Ltd."
    },
    {
      "name": "Proengin"
    },
    {
      "name": "RUAG Defence"
    },
    {
      "name": "Renault Trucks Defense"
    },
    {
      "name": "Respirator"
    },
    {
      "name": "Rheinmetall Chempro GmbH"
    },
    {
      "name": "SCHOTT AG"
    },
    {
      "name": "SCHROTH Safety Products GmbH"
    },
    {
      "name": "Saab Barracuda"
    },
    {
      "name": "Scanfiber Composites UK Ltd"
    },
    {
      "name": "Shield Technologies"
    },
    {
      "name": "Sika"
    },
    {
      "name": "Sil-Mid"
    },
    {
      "name": "SpanSet"
    },
    {
      "name": "Stream Enviro"
    },
    {
      "name": "Streit Group"
    },
    {
      "name": "Systematic"
    },
    {
      "name": "Timoney Technology Ltd"
    },
    {
      "name": "Transhield"
    },
    {
      "name": "Tyron Developments Ltd"
    },
    {
      "name": "Universal Engineering Group (UN)"
    },
    {
      "name": "ViaSat, Inc"
    },
    {
      "name": "Vitavox"
    },
    {
      "name": "WARN INDUSTRIES"
    },
    {
      "name": "Yugoimport"
    }
  ]
}
