{
  "name": "IFSEC Bangladesh 2019",
  "series": "IFSEC Bangladesh",
  "edition": "2019",
  "alias": [
    "International Fire Security Exhibition and Conference Bangladesh"
  ],
  "startDate": "2019-04-18",
  "endDate": "2019-04-20",
  "address": "ICCB\nDhaka\nBangladesh",
  "website": "https://www.ifsec.events/bangladesh/",
  "organiser": [
    {
      "name": "UBM India"
    },
    {
      "name": "Informa Markets",
      "website": "https://www.informamarkets.com/"
    }
  ]
}
