{
  "name": "International Military Helicopter 2024",
  "series": "International Military Helicopter",
  "edition": "2024",
  "startDate": "2024-02-27",
  "endDate": "2024-02-29",
  "address": {
    "text": "Twickenham Stadium\n200 Whitton Rd\nTwickenham\nTW2 7BA\nUnited Kingdom",
    "iso2": "GB",
    "lat": 51.4559558,
    "lon": -0.3415051
  },
  "website": "https://www.defenceiq.com/events-militaryhelicopter",
  "organiser": [
    {
      "name": "Defence IQ",
      "website": "http://www.defenceiq.com"
    },
    {
      "name": "Institute for Defense and Government Advancement",
      "alias": "IDGA",
      "website": "https://www.idga.org/"
    }
  ],
  "exhibitorListUrl": "https://www.defenceiq.com/events-militaryhelicopter/sponsors",
  "exhibitorListDate": "2024-04-10T09:05:37+00:00",
  "exhibitor": [
    {
      "name": "ARKA",
      "website": "arka.org"
    },
    {
      "name": "Airbus"
    },
    {
      "name": "Ascent",
      "website": "ascentflighttraining.com"
    },
    {
      "name": "Bell",
      "website": "www.bellflight.com"
    },
    {
      "name": "Boeing",
      "website": "www.boeing.com"
    },
    {
      "name": "Chelton",
      "website": "chelton.com"
    },
    {
      "name": "Collins Aerospace",
      "website": "collinsaerospace.com"
    },
    {
      "name": "DA Group",
      "website": "www.da-group.com"
    },
    {
      "name": "FlySight",
      "website": "www.flysight.it"
    },
    {
      "name": "GE Aerospace",
      "website": "www.geaerospace.com"
    },
    {
      "name": "GTA Containers",
      "website": "www.gtacontainers.com"
    },
    {
      "name": "Hensoldt",
      "website": "https://www.hensoldt.net"
    },
    {
      "name": "HoodTech Vision",
      "website": "hoodtechvision.com"
    },
    {
      "name": "Leonardo"
    },
    {
      "name": "MD Helicopter",
      "website": "mdhelicopters.com"
    },
    {
      "name": "Marvin Test Solutions",
      "website": "www.marvintest.com"
    },
    {
      "name": "NHIndustries",
      "website": "www.nhindustries.com"
    },
    {
      "name": "Nova Systems",
      "website": "www.novasystems.com"
    },
    {
      "name": "Sikorsky"
    },
    {
      "name": "Snap-on Industrial",
      "website": "snapon-industrial.co.uk"
    },
    {
      "name": "Thales",
      "website": "www.thalesgroup.com"
    }
  ]
}
