{
  "name": "DIMDEX 2022",
  "series": "DIMDEX",
  "edition": "2022",
  "alias": "Doha International Maritime Defence Exhibition and Conference 2022",
  "startDate": "2022-03-21",
  "endDate": "2022-03-23",
  "address": "Qatar National Convention Centre (QNCC)\nDoha\nQatar",
  "website": "http://www.dimdex.com",
  "social": [
    {
      "platform": "facebook",
      "url": "https://www.facebook.com/dimdexqatar/"
    },
    {
      "platform": "twitter",
      "url": "https://twitter.com/DIMDEXQatar"
    },
    {
      "platform": "youtube",
      "url": "https://www.youtube.com/channel/UCpHS5Sf4nFhSAMRm2CTe5Vg/videos"
    }
  ],
  "organiser": [
    {
      "name": "Qatar Armed Forces"
    }
  ],
  "delegationListUrl": "https://dimdex.com/vip-delegations/",
  "delegationListDate": "2022-02-09T16:26:43+00:00",
  "delegation": [
    {
      "name": "ALGERIA"
    },
    {
      "name": "ARGENTINA"
    },
    {
      "name": "AUSTRALIA"
    },
    {
      "name": "AUSTRIA"
    },
    {
      "name": "AZERBAIJAN"
    },
    {
      "name": "BANGLADESH"
    },
    {
      "name": "BELARUS"
    },
    {
      "name": "BELGIUM"
    },
    {
      "name": "BOSNIA AND HERZEGOVINA"
    },
    {
      "name": "BRAZIL"
    },
    {
      "name": "THE BRUNEI DARUSSALAM"
    },
    {
      "name": "BULGARIA"
    },
    {
      "name": "BURKINA FASO"
    },
    {
      "name": "KINGDOM OF CAMBODIA"
    },
    {
      "name": "CAMEROON"
    },
    {
      "name": "CANADA"
    },
    {
      "name": "CHAD"
    },
    {
      "name": "CHILE"
    },
    {
      "name": "CHINA"
    },
    {
      "name": "COLOMBIA"
    },
    {
      "name": "CROATIA"
    },
    {
      "name": "DENMARK"
    },
    {
      "name": "DJIBOUTI"
    },
    {
      "name": "DOMINICAN REPUBLIC"
    },
    {
      "name": "ECUADOR"
    },
    {
      "name": "EGYPT"
    },
    {
      "name": "ERITREA"
    },
    {
      "name": "ETHIOPIA"
    },
    {
      "name": "FINLAND"
    },
    {
      "name": "FRANCE"
    },
    {
      "name": "GERMANY"
    },
    {
      "name": "GHANA"
    },
    {
      "name": "GREECE"
    },
    {
      "name": "GUINEA"
    },
    {
      "name": "INDIA"
    },
    {
      "name": "INDONESIA"
    },
    {
      "name": "IRAQ"
    },
    {
      "name": "IRELAND"
    },
    {
      "name": "ITALY"
    },
    {
      "name": "IVORY COAST"
    },
    {
      "name": "JAPAN"
    },
    {
      "name": "JORDAN"
    },
    {
      "name": "KAZAKHSTAN"
    },
    {
      "name": "KENYA"
    },
    {
      "name": "KUWAIT"
    },
    {
      "name": "LEBANON"
    },
    {
      "name": "MALAYSIA"
    },
    {
      "name": "MALI"
    },
    {
      "name": "MALTA"
    },
    {
      "name": "MEXICO"
    },
    {
      "name": "MONGOLIA"
    },
    {
      "name": "KINGDOM OF MOROCCO"
    },
    {
      "name": "NATO"
    },
    {
      "name": "NETHERLANDS"
    },
    {
      "name": "NIGER"
    },
    {
      "name": "NIGERIA"
    },
    {
      "name": "NORWAY"
    },
    {
      "name": "OMAN"
    },
    {
      "name": "ISLAMIC REPUBLIC OF PAKISTAN"
    },
    {
      "name": "PERU"
    },
    {
      "name": "PHILIPPINES"
    },
    {
      "name": "POLAND"
    },
    {
      "name": "ROMANIA"
    },
    {
      "name": "RUSSIA"
    },
    {
      "name": "RWANDA"
    },
    {
      "name": "SENEGAL"
    },
    {
      "name": "SINGAPORE"
    },
    {
      "name": "SOMALIA"
    },
    {
      "name": "SOUTH AFRICA"
    },
    {
      "name": "SOUTH KOREA"
    },
    {
      "name": "SPAIN"
    },
    {
      "name": "SRI LANKA"
    },
    {
      "name": "SUDAN"
    },
    {
      "name": "SWEDEN"
    },
    {
      "name": "TANZANIA"
    },
    {
      "name": "KINGDOM OF THAILAND"
    },
    {
      "name": "TUNISIA"
    },
    {
      "name": "TÃœRKIYE"
    },
    {
      "name": "UGANDA"
    },
    {
      "name": "UKRAINE"
    },
    {
      "name": "UNITED KINGDOM"
    },
    {
      "name": "UNITED STATES OF AMERICA"
    },
    {
      "name": "VENEZUELA"
    }
  ]
}
