{
  "name": "IAVs 2018",
  "series": "IAVs",
  "edition": "2018",
  "alias": "International Armoured Vehicles 2018",
  "startDate": "2018-01-22",
  "endDate": "2018-01-25",
  "address": "Twickenham Stadium\n200 Whitton Road Twickenham\nLondon TW2 7BA\nUnited Kingdom",
  "website": "http://www.internationalarmouredvehicles.com",
  "social": [
    {
      "platform": "twitter",
      "url": "http://twitter.com/IAVehicles"
    },
    {
      "platform": "linkedin",
      "url": "https://www.linkedin.com/groups/162026"
    },
    {
      "platform": "facebook",
      "url": "https://www.facebook.com/DefenceIQNetwork/"
    }
  ],
  "organiser": [
    {
      "name": "IQPC",
      "website": "http://www.iqpc.com"
    },
    {
      "name": "Defence IQ",
      "website": "http://www.defenceiq.com",
      "social": [
        {
          "platform": "youtube",
          "url": "https://www.youtube.com/user/TheDefenceIQ"
        }
      ]
    }
  ],
  "exhibitorListUrl": "https://www.internationalarmouredvehicles.com/sponsors",
  "exhibitorListDate": "2021-03-11T13:33:03+00:00",
  "exhibitor": [
    {
      "name": "NIMR",
      "website": "http://www.nimr.ae"
    },
    {
      "name": "BAE Systems",
      "website": "http://www.baesystems.com"
    },
    {
      "name": "General Dynamics Land Systems",
      "website": "http://gdls.com/"
    },
    {
      "name": "Nexter",
      "website": "http://www.nexter-group.com"
    },
    {
      "name": "Patria",
      "website": "http://www.patria.fi"
    },
    {
      "name": "Rheinmetall Defence",
      "website": "http://www.rheinmetall-defence.com/"
    },
    {
      "name": "RUAG Defence",
      "website": "http://www.ruag.com"
    },
    {
      "name": "Leonardo",
      "website": "http://www.leonardocompany.com/en"
    },
    {
      "name": "Lockheed Martin",
      "website": "http://www.lockheedmartin.com"
    },
    {
      "name": "Thales",
      "website": "http://www.thalesgroup.com"
    },
    {
      "name": "CMI Defence",
      "website": "http://www.cmigroupe.com/en/p/sector-defence"
    },
    {
      "name": "FFG",
      "website": "http://www.ffg-flensburg.de/en/home/"
    },
    {
      "name": "Morgan Advanced Materials",
      "website": "http://www.morganadvancedmaterials.com/"
    },
    {
      "name": "Rafael Advanced Defense Systems Ltd.",
      "website": "http://www.rafael.co.il/Marketing/203-en/Marketing.aspx"
    },
    {
      "name": "Raytheon",
      "website": "http://www.raytheon.com"
    },
    {
      "name": "Revision Military",
      "website": "https://www.revisionmilitary.com/"
    },
    {
      "name": "Soucy Defense",
      "website": "http://www.soucy-defense.com/home"
    },
    {
      "name": "Texelis",
      "website": "http://www.texelis.com"
    },
    {
      "name": "ADS (Active Defence Systems)",
      "website": "http://www.ads-protection.org/"
    },
    {
      "name": "Allison Transmission",
      "website": "http://www.allisontransmission.com/"
    },
    {
      "name": "American Panel Corporation",
      "website": "http://american-panel.com/"
    },
    {
      "name": "Amphenol",
      "website": "http://www.amphenolmao.com"
    },
    {
      "name": "ARTEC GmbH",
      "website": "http://artec-boxer.com/"
    },
    {
      "name": "EnerSys",
      "website": "http://www.enersys.com/GlobalLanding.aspx"
    },
    {
      "name": "Esterline | Control & Communication Systems",
      "website": "http://www.esterline.com"
    },
    {
      "name": "Metravib",
      "website": "http://metravib.acoemgroup.com/"
    },
    {
      "name": "Milspec",
      "website": "http://milspecmanufacturing.com/"
    },
    {
      "name": "NLMK Clabecq",
      "website": "http://quardian.me/"
    },
    {
      "name": "Palomar Display Products, Inc.",
      "website": "http://www.palomardisplays.com/"
    },
    {
      "name": "TII Group",
      "website": "https://www.tii-group.com/"
    },
    {
      "name": "Ultra PALS",
      "website": "http://www.ultra-pals.com/"
    },
    {
      "name": "UTC Aerospace Systems",
      "website": "http://www.utcaerospacesystems.com"
    },
    {
      "name": "AmSafe Bridport",
      "website": "http://www.amsafebridport.com"
    },
    {
      "name": "Bren Tronics",
      "website": "https://www.bren-tronics.com/"
    },
    {
      "name": "Caterpillar Defence Products",
      "website": "http://www.cat.com/en_GB/products/new/by-industry/governmental-defense.html"
    },
    {
      "name": "FN Herstal",
      "website": "http://www.fnherstal.com/"
    },
    {
      "name": "ITT Corporation",
      "website": "http://www.itt.com/Home/"
    },
    {
      "name": "Jankel",
      "website": "http://www.jankel.com/"
    },
    {
      "name": "Kent Modular Electronics",
      "website": "http://www.kme.co.uk/"
    },
    {
      "name": "Michelin Tires",
      "website": "http://www.michelin.ie/"
    },
    {
      "name": "Microflown AVISA",
      "website": "http://www.microflown-avisa.com"
    },
    {
      "name": "NBC-Sys",
      "website": "http://www.nexter-group.fr/en/subsidiaries/nbc-sys"
    },
    {
      "name": "Pearson Engineering",
      "website": "http://www.pearson-eng.com/"
    },
    {
      "name": "Proengin",
      "website": "http://www.proengin.com/"
    },
    {
      "name": "QinetiQ",
      "website": "http://www.qinetiq.com"
    },
    {
      "name": "Radnor",
      "website": "http://radnor.org.uk/"
    },
    {
      "name": "Scepter Canada",
      "website": "http://mil.sceptermilitary.com/"
    },
    {
      "name": "TenCate Advanced Armour",
      "website": "http://www.tencate.com"
    },
    {
      "name": "Timoney Technology",
      "website": "http://timoneygroup.com/Index.aspx"
    },
    {
      "name": "Tyron Runflat Ltd",
      "website": "http://www.tyron.com"
    },
    {
      "name": "Vitec",
      "website": "https://www.vitec.com/"
    },
    {
      "name": "Beth-El Zikhron Yaaqov Industries Ltd.",
      "website": "http://www.beind.com/"
    },
    {
      "name": "FNSS - Savunma Sistemleri A.S.",
      "website": "http://www.fnss.com.tr"
    },
    {
      "name": "IBD Deisenroth Engineering",
      "website": "http://www.ibd-deisenroth-engineering.de/"
    },
    {
      "name": "Saab",
      "website": "http://saab.com/"
    },
    {
      "name": "Newton Europe",
      "website": "http://www.newtoneurope.com"
    }
  ]
}
