{
  "name": "AOC Europe 2018",
  "series": "AOC Europe",
  "edition": "2018",
  "alias": [
    "Association of Old Crows 2018",
    "Electronic Warfare Europe 2018",
    "EW Europe 2018"
  ],
  "startDate": "2018-06-05",
  "endDate": "2018-06-07",
  "address": {
    "text": "Congr√®s Beaulieu\nLausanne\nSwitzerland",
    "iso2": "CH",
    "lat": 46.5287017,
    "lon": 6.6259245
  },
  "website": "https://www.eweurope.com",
  "organiser": {
    "name": "Clarion Defence & Security"
  }
}
